{"dataset_class":"SYNTHETIC_INTERNAL","synthetic":true,"disclaimer":"프로젝트 시연을 위해 생성한 합성 수신 기록이며 실제 KB 내부자료가 아닙니다.","receipt_id":"notice-receipt:22222222222222222222222222222222","notice_id":"SIN-SELLER-CHECKLIST-V2","received_at":"2026-09-25T01:00:00Z","business_timezone":"Asia/Seoul","timezone_policy_version":"internal-business-time-v1"}
