{"dataset_class":"SYNTHETIC_INTERNAL","synthetic":true,"disclaimer":"프로젝트 시연을 위해 생성한 합성 수신 기록이며 실제 KB 내부자료가 아닙니다.","receipt_id":"notice-receipt:aaaaaaaaaaaaaaaaaaaaaaaaaaaaaaaa","notice_id":"SIN-PREPAYMENT-FEE-V1","received_at":"2026-09-10T23:40:00Z","business_timezone":"Asia/Seoul","timezone_policy_version":"internal-business-time-v1"}
